Project Name,Opportunity ID,Opportunity Name,Creative Format,Hooks,scripts,Ad Copy,Technical Directions,Opportunity Owner,Pipeline,Contact Id
"Wayso Project","C12-WA","[C12-WA] Carousel - خايف تطيح في وكالة ماشي تاع ثقة؟ احفظ عندك هاد الـ","Carousel","خايف تطيح في وكالة ماشي تاع ثقة؟ احفظ عندك هاد الـ 7 علامات.","Slide 1: 7 علامات تخليك تختار وكالة الحج والعمرة وعينيك مغمضين.
Slide 2: 1. الترخيص الرسمي: تأكد من أن الوكالة معتمدة من طرف السلطات الرسمية. هذا هو أول خط أمان ليك.
Slide 3: 2. الخبرة والتاريخ: وكالة عندها سنين في الميدان ماشي كيما وكالة فتحت البارح. الخبرة تعني معرفة وحلول.
Slide 4: 3. شفافية الأسعار: لازم تعرف كل مليم وين يروح. أي غموض في الفاتورة هو علامة سيئة.
Slide 5: 4. شهادات عملاء حقيقية: ابحث عن تقييماتهم على جوجل وفيسبوك. شوف الناس الحقيقيين واش قالو.
Slide 6: 5. الدعم المتواصل: هل عندهم فريق يجاوبك 24/7 في الأراضي المقدسة؟ الدعم وقت الحاجة لا يقدر بثمن.
Slide 7: 6. جودة الخدمات: اسأل بالتحديد عن اسم الفندق وبعده عن الحرم، ونوعية النقل. لا تقبل بـ 'فندق 5 نجوم' بدون تفاصيل.
Slide 8: الكوثر للرحلات: بكل فخر، نستوفي كل هذه العلامات وأكثر. ثقتكم هي رأس مالنا.","دليلك الكامل لاختيار وكالة السفر الموثوقة! (احفظه للمستقبل) ✅ 

 الاختيار الصحيح يبدأ بالمعرفة الصحيحة. باش تحمي رحلتك وتحمي أموالك، لازم تعرف على واش تحوس بالضبط.

جمعنالك في هذا الكاروسال 7 علامات أساسية ومباشرة. إذا وجدتها في وكالة، تقدر تكون مطمئن بنسبة كبيرة.

هذا الدليل هو استثمار في راحة بالك. 

 احفظ هذا المنشور عندك، وكي تجي تحجز، استعملو كقائمة تدقيق. ولمعرفة كيف نطبق في الكوثر كل هذه المعايير، تواصل معنا. 

 #دليل_الأمان #ثقة #مصداقية #وكالة_موثوقة #حج_وعمرة #الجزائر #معلومات #لا_للغش","تصميم إنفوجرافيك جذاب ومرتب. كل سلايد يركز على علامة واحدة مع أيقونة معبرة (وثيقة رسمية، تقويم، فاتورة شفافة، نجمة تقييم، هاتف، فندق). استخدام الأرقام بشكل كبير وواضح. في السلايد الأخير، وضع 'Check mark' (علامة صح) بجانب شعار الكوثر.","Abderahmane Mohamed","Project Task Manager","QkU5OHqs50n5oCnAzV9d"
"Wayso Project","P13-WA","[P13-WA] Image - أصعب جملة ممكن تقولها بعد رحلة العمر: 'يا ريتني خي","Image","أصعب جملة ممكن تقولها بعد رحلة العمر: 'يا ريتني خيرت مليح'.","الندم بعد فوات الأوان... هو أصعب شعور.

خاصةً عندما يتعلق الأمر برحلة لا تتكرر.

اختر بحكمة اليوم... لترتاح غداً.","كلمة 'يا ريت' ما ترجعش لي فات... 😔 

 البعض يختار على أساس السعر الأرخص، والبعض يختار بسرعة بدون بحث... والنتيجة غالباً ما تكون تجربة ناقصة وندم كبير.

رحلة الحج أو العمرة هي استثمار روحي ونفسي قبل أن يكون مادياً. لا تسترخص في راحة بالك وطمأنينتك.

مع الكوثر، نعدك برحلة تتذكرها بالسعادة والرضا، وليس بالندم. 

 لا تدع الندم يطرق بابك. احجز مع الأمان والخبرة. تواصل مع الكوخر الآن. 

 #الندم #الاختيار_الحكيم #رحلة_العمر #لا_للمغامرة #الكوثر_أمان #عبرة #حج #عمرة","تصميم درامي ومؤثر. صورة ظلية (silhouette) لشخص ينظر بحسرة من نافذة، مع خلفية ضبابية لمكة. النص مكتوب بخط رفيع ومعبر. التركيز على إيصال شعور الندم والحسرة بصرياً.","Abderahmane Mohamed","Project Task Manager","QkU5OHqs50n5oCnAzV9d"
"Wayso Project","V14-WA","[V14-WA] Video - الراحة ماشي غير كلمة نقولوها... شوف بعينيك واش معن","Video","الراحة ماشي غير كلمة نقولوها... شوف بعينيك واش معناها 'راحة بال' مع الكوثر.","(صوت الراوي، بنبرة واضحة ومفصلة)
راحة البال تبدأ من التفاصيل.
في الكوثر، راحتك هي خريطة طريقنا.
فنادقنا؟ اخترناها بعناية... قريبة من الحرم باش ما تتعبش.
نقلنا؟ حافلات حديثة ومكيفة، بمواعيد دقيقة تحترم برنامجك.
مرشدينا؟ ماشي مجرد مرافقين، هوما خاوتك لي يوقفو معاك في كل خطوة.
الأكل؟ نحرص على توفير وجبات صحية ونظيفة تناسب الجميع.
والدعم الطبي؟ متوفر في أي لحظة تحتاجها.
كل تفصيل، مهما كان صغير، مدروس على جالك.
لأننا نؤمن بأن الرحلة الروحانية الصافية تبنى على أساس من الراحة المادية الكاملة.","تعرف على تفاصيل الراحة اللي نضمنوها لك! 🏨🚌👨‍⚕️ 

 'خدمة ممتازة' كلمة واسعة، لكن حنا في الكوثر نحبو ندخلو في التفاصيل.

لأننا نعرف أن راحتك في رحلة العمر تتكون من مجموعة من التفاصيل الصغيرة: قرب الفندق، راحة الحافلة، وجود مرشد يفهمك، والشعور بالأمان الصحي.

شاهد هذا الفيديو لتعرف بالضبط كيف نضمن كل جانب من جوانب رحلتك لتكون تجربة مثالية. 

 اكتشف برامجنا المفصلة لراحة بالك. اضغط على الرابط في البايو. 

 #تفاصيل_الراحة #خدمة_خمس_نجوم #الكوثر_تهتم #جودة_عالية #عمرة_VIP #حج_مريح #الجزائر","فيديو رسوم متحركة (Motion Graphics) سريع وممتع. كل خدمة يتم تمثيلها بأيقونة ورسم متحرك بسيط (أيقونة فندق تتحرك نحو الحرم، أيقونة حافلة تسير بسلاسة، أيقونة مرشد يبتسم، أيقونة وجبة صحية، أيقونة طبيب). النص يظهر على الشاشة متزامناً مع صوت الراوي. الموسيقى تكون إيجابية ومحفزة.","Ahmed Benkali","Project Task Manager","QkU5OHqs50n5oCnAzV9d"
"Wayso Project","C15-WA","[C15-WA] Carousel - من أول مكالمة معانا حتى ترجع لبلادك بالسلامة... ها","Carousel","من أول مكالمة معانا حتى ترجع لبلادك بالسلامة... هاذي هي رحلتك معانا.","Slide 1: رحلتك المقدسة خطوة بخطوة: مع الكوثر، كل شيء واضح ومنظم.
Slide 2: 1. الاستشارة والحجز: فريقنا يسمعلك، يفهم احتياجاتك، ويقترح عليك أفضل برنامج. عملية الحجز سهلة وشفافة.
Slide 3: 2. التحضير للسفر: نزودك بكل المعلومات والنصائح اللازمة. من الوثائق حتى واش تحط في الحقيبة ديالك.
Slide 4: 3. الوصول والإقامة: نستقبلك في المطار ونرافقك لفندقك المريح. راحتك من أول دقيقة هي أولويتنا.
Slide 5: 4. أداء المناسك: مرشدونا المتخصصون يكونو معاك في كل منسك، يشرحولك ويوجهوك باش تكون عبادتك صحيحة ومقبولة.
Slide 6: 5. الزيارات والمزارات: ننظم لك برنامج زيارات لأهم الأماكن المقدسة والتاريخية لإثراء تجربتك الروحانية.
Slide 7: 6. العودة للوطن: نرافقك حتى للمطار ونضمن لك عودة سالمة لأرض الوطن، محملاً بالذكريات الطيبة.
Slide 8: في كل خطوة من هذه الرحلة... الكوثر للرحلات هي دليلك ورفيقك الأمين.","ما تحتارش وما تتعبش... رحلتك معانا واضحة من الألف إلى الياء! 🗺️ 

 أحد أكبر المخاوف عند السفر هو الغموض. واش راح يصرا؟ وين نروح؟ مع من نهدر؟

مع الكوثر، لا مكان للغموض. نقدملك خريطة طريق كاملة وواضحة لرحلتك من أول اتصال حتى عودتك سالماً.

هدفنا هو أن تشعر بالأمان والطمأنينة في كل خطوة، وتتفرغ تماماً لعبادتك. 

 خطط لرحلتك بكل سهولة ويسر. استشرنا الآن ودعنا نتكفل بالباقي. 

 #خريطة_الطريق #رحلة_منظمة #خطوة_بخطوة #الكوثر_دليلك #لا_للغموض #عمرة_سهلة #حج_منظم #الجزائر","تصميم على شكل خريطة طريق أو خط زمني (Timeline). كل سلايد يمثل محطة في الرحلة. استخدام أيقونات ورسوم توضيحية لكل مرحلة (هاتف، حقيبة سفر، طائرة، فندق، كعبة، حافلة). الألوان تكون متدرجة لتعطي إحساساً بالتقدم. الخط واضح ومباشر.","Abderahmane Mohamed","Project Task Manager","QkU5OHqs50n5oCnAzV9d"
"Wayso Project","P16-WA","[P16-WA] Image - العبادة تحتاج صفاء الذهن وراحة الجسد. شكون يخمم في","Image","العبادة تحتاج صفاء الذهن وراحة الجسد. شكون يخمم في صحتك هناك؟","صحتك الجسدية والنفسية... جزء من أمانة رحلتك.

الكوثر للرحلات توفر لك الدعم الطبي والمرافقة لضمان تفرغك الكامل لعبادتك.","لأن صحتك أمانة... نوفر لك الرعاية في أطهر مكان. 🩺 

 التعب والإرهاق وحتى المشاكل الصحية البسيطة يمكن أن تؤثر على تجربتك الروحانية.

في الكوثر، نحن ندرك هذا الأمر جيداً، ولهذا نضع الرعاية الصحية والدعم النفسي ضمن أولوياتنا. فريقنا جاهز لتقديم المساعدة والمشورة في أي وقت لضمان أن تبقى في أفضل حال لأداء مناسكك براحة وسكينة. 

 اطمئن على صحتك وروحانياتك. تعرف على خدمات الدعم الطبي المتاحة في برامجنا. 

 #الرعاية_الصحية #صحتك_أولا #الكوثر_ترعاك #دعم_طبي #حج_آمن #عمرة_صحية #الجزائر #اطمئنان","تصميم هادئ ومطمئن. صورة مقربة لطبيب أو ممرض يبتسم بلطف لحاج كبير في السن. الألوان تكون بيضاء وخضراء فاتحة لتوحي بالصحة والأمان. النص يكون قليلاً ومباشراً. وضع شعار الصليب الأحمر أو الهلال الأحمر بشكل بسيط بجانب النص.","Abderahmane Mohamed","Project Task Manager","QkU5OHqs50n5oCnAzV9d"
"Wayso Project","V17-WA","[V17-WA] Video - أحسن حاجة تسمعها؟ دعوة خير من والديك. وأحسن حاجة ت","Video","أحسن حاجة تسمعها؟ دعوة خير من والديك. وأحسن حاجة تشوفها؟ فرحتهم.","(مجموعة شهادات من أبناء حقيقيين، مصورة بطريقة عفوية بالهاتف)
الابن 1: 'الحمد لله كي اخترت الكوثر لوالديا. كل يوم نتصل بيهم نلقاهم فرحانين ومرتاحين. هاديك هي الدنيا.'
الابنة 2: 'كنت خايفة عليهم بزاف، بصح فريق الكوثر كانوا أكثر من عائلة ليهم. يعطيهم ألف صحة.'
الابن 3: 'الوالد قالي بالحرف: يا ولدي، حسيت روحي سلطان معاهم. هاد الكلمة تكفيني.'
(لقطات حقيقية للوالدين في الأراضي المقدسة يبتسمون ويرسلون رسائل شكر لأبنائهم)
الراوي: 'رضاهم... وراحة بالك. هذا هو هدفنا في الكوثر.'","ماشي حنا لي نشكرو خدمتنا... أولاد عملائنا هوما لي يحكيو. 💬❤️ 

 لا يوجد دليل على جودة الخدمة أقوى من شهادة صادقة من القلب.

جمعنا لكم في هذا الفيديو قصص حقيقية ومؤثرة لأبناء وضعوا أغلى ما يملكون -والديهم- أمانة بين أيدينا. اسمعوا بأنفسكم كيف كانت تجربتهم، وكيف تحولت مخاوفهم إلى طمأنينة ورضا.

هذه الشهادات هي فخرنا الحقيقي. 

 حقق رضا والديك وراحة بالك. انضم إلى عائلة الكوثر واحجز لهم رحلة الأحلام. 

 #شهادات_حية #قصص_حقيقية #بر_الوالدين #شكرا_الكوثر #عملاء_سعداء #رضا_الوالدين #الجزائر #ثقة","الفيديو يعتمد بالكامل على UGC (محتوى أنشأه المستخدمون). يجب أن تكون الشهادات صادقة وعفوية. المونتاج يجمع بين شهادات الأبناء ولقطات فيديو أرسلها الوالدان من رحلتهم. الموسيقى تكون عاطفية جداً ومؤثرة. يجب إضافة ترجمة (Subtitles) واضحة للكلام.","Ahmed Benkali","Project Task Manager","QkU5OHqs50n5oCnAzV9d"
"Wayso Project","C18-WA","[C18-WA] Carousel - علاش الناس تختار الكوثر وتعاود؟ اسمع واش قالو فينا","Carousel","علاش الناس تختار الكوثر وتعاود؟ اسمع واش قالو فينا.","Slide 1: قالوا فينا... كلمات الثقة والرضا من عائلتنا الكبيرة.
Slide 2: عن رعاية الوالدين: 'عمري ما شفت اهتمام بكبار السن كيما شفت مع الكوثر. حسيت بابا ويما في أيد أمينة.' - سارة. ب
Slide 3: عن حل الأزمات: 'صرالنا مشكل في الوثائق، فريق الكوثر حله في وقت قياسي وبدون ما نحسو بأي توتر.' - كريم. م
Slide 4: عن جودة الإقامة: 'الفنادق كانت قريبة ونظيفة جداً. وفرت علينا تعب كبير.' - فاطمة. ز
Slide 5: عن المرشدين: 'المرشد كان معانا خطوة بخطوة، صبور ومتفهم. الله يبارك فيه.' - محمد. ع
Slide 6: انضم أنت أيضاً لعائلة الكوثر، وعش تجربة يتحدث عنها الجميع بالخير.","صوت عملائنا هو أقوى إعلان لينا! 📢 

 عندما يتحدث الجميع عن نفس التجربة الإيجابية، فاعلم أنك في المكان الصحيح.

في هذا الكاروسال، نعرض لكم مقتطفات من آراء عائلتنا الكبيرة، عائلة الكوثر. كل شهادة تسلط الضوء على جانب من جوانب خدمتنا التي نفخر بها: من الرعاية الإنسانية إلى الجودة الفائقة.

آراؤكم هي وقودنا لنستمر في تقديم الأفضل. 

 انضم إلى قائمة عملائنا الراضين. اقرأ المزيد من الشهادات على موقعنا الإلكتروني. 

 #اراء_العملاء #ماذا_يقول_الناس_عنا #الكوثر_في_القلب #تجربة_مميزة #شهادات_عملاء #الجزائر #سياحة","تصميم يعتمد على الاقتباسات. كل سلايد يعرض اقتباساً واحداً بخط كبير وواضح، مع اسم العميل (أو الأحرف الأولى منه للخصوصية). استخدام صور خلفية معبرة وذات جودة عالية لكل شهادة (صورة يد تمسك بيد شخص مسن، صورة فندق فخم، إلخ).","Abderahmane Mohamed","Project Task Manager","QkU5OHqs50n5oCnAzV9d"
"Wayso Project","P19-WA","[P19-WA] Image - ما تصدقنيش أنا... صدق المئات من التقييمات الإيجابي","Image","ما تصدقنيش أنا... صدق المئات من التقييمات الإيجابية.","⭐⭐⭐⭐⭐
'الكلمة الطيبة والخدمة المتقونة'

#الكوثر_ثقة_وامان

ابحث عنا بنفسك وشوف تقييماتنا.","التقييمات لا تكذب! ⭐⭐⭐⭐⭐ 

 في عصر المعلومة، أفضل طريقة لمعرفة مصداقية أي خدمة هي البحث عن تقييماتها.

نحن في الكوثر للرحلات، نفخر بالسمعة الطيبة التي بنيناها على مدار سنوات، وندعوكم بكل ثقة للبحث عنا وقراءة تقييمات عملائنا على مختلف المنصات.

الشفافية هي أساس الثقة. 

 ابحث عنا الآن على جوجل وفيسبوك، وشوف بنفسك علاش الناس تختار #الكوثر_ثقة_وامان. 

 #تقييمات_ايجابية #خمس_نجوم #ثقة_العملاء #دليل_الجودة #سمعة_طيبة #الجزائر #وكالة_سفر","تصميم بسيط ومباشر جداً. خمس نجمات ذهبية كبيرة في الأعلى. تحتها اقتباس قصير وقوي من أحد التقييمات. في الأسفل، الهاشتاج الرسمي ' #الكوثر_ثقة_وامان ' وشعار الوكالة. الخلفية تكون بلون سادة من ألوان الهوية البصرية.","Abderahmane Mohamed","Project Task Manager","QkU5OHqs50n5oCnAzV9d"
"Wayso Project","V20-WA","[V20-WA] Video - حلم العمرة ولا الحج لي راك تأجل فيه كل عام... ممكن","Video","حلم العمرة ولا الحج لي راك تأجل فيه كل عام... ممكن يتحقق هذا الموسم!","(الوجه الإعلامي يظهر على الشاشة بحماس)
شحال من واحد فينا راه يقول: العام الجاي إن شاء الله؟
شحال من واحد يتمنى يدي والديه لكن الظروف ما سمحتش؟
أنا اليوم جبتلكم خبر يفرح.
الكوثر للرحلات فتحت التسجيلات لبرنامج الموسم الجديد... وبأماكن محدودة جداً!
هذه ماشي مجرد رحلة، هذه فرصة ذهبية.
فرصة باش تحقق حلمك، فرصة باش تبر بوالديك.
بصح لازم تعرفو حاجة، المقاعد محدودة والعرض هذا استثنائي.
ما تخليش كلمة 'يا ريت' تجيك مرة أخرى.
العام هذا... ممكن يكون هو عامك.","🚨 عاجل: فرصة العمر بين يديك الآن! لا تدعها تفوتك! 

 هل تنتظر الإشارة المناسبة لتحقيق حلمك بزيارة البقاع المقدسة؟

اعتبر هذا الفيديو هو الإشارة!

وكالة الكوثر للرحلات تعلن عن افتتاح التسجيلات لبرنامج الموسم الاستثنائي. فرصة لا تعوض لتحقيق حلمك أو حلم والديك بأفضل الظروف وأحسن الخدمات.

لكن انتبه، المقاعد محدودة جداً والطلب كبير! 

 العرض لن يدوم طويلاً! احجز مقعدك الآن وتواصل معنا فوراً قبل امتلاء كل الأماكن. 

 #عرض_خاص #فرصة_العمر #مقاعد_محدودة #الحج_ينادي #العمرة_تنتظر #الكوثر_للرحلات #احجز_الآن #الجزائر","الوجه الإعلامي (Host) يتحدث بحماس وشغف. الخلفية تعرض لقطات سينمائية ملهمة للحرم المكي والمدني. عند ذكر 'أماكن محدودة'، تظهر على الشاشة عبارة 'مقاعد محدودة جداً' بخط كبير وأحمر. الإضاءة تكون احترافية. نبرة الصوت يجب أن تكون مقنعة وتحفيزية وتخلق شعوراً بالإلحاح.","Ahmed Benkali","Project Task Manager","QkU5OHqs50n5oCnAzV9d"
"Wayso Project","C21-WA","[C21-WA] Carousel - تفاصيل العرض لي راه داير حالة... كلش واضح هنا.","Carousel","تفاصيل العرض لي راه داير حالة... كلش واضح هنا.","Slide 1: حصرياً! تفاصيل برنامج الكوثر المميز لهذا الموسم.
Slide 2: إقامة راقية: فنادق 5 نجوم مطلة على الحرم أو على بعد خطوات فقط. راحتك تبدأ من سكنك.
Slide 3: مدة الرحلة: برنامج متكامل يتيح لك أداء مناسكك براحة تامة والاستمتاع بكل لحظة روحانية.
Slide 4: خدماتنا الإضافية: نقل VIP، مرشد ديني مرافق، وجبات فطور وعشاء، هدايا قيمة لكل معتمر.
Slide 5: السعر وشروط الحجز: شفافية تامة في الأسعار. اتصل بنا لمعرفة التفاصيل كاملة وخيارات الدفع المتاحة.
Slide 6: لا تفوت الفرصة! المقاعد محدودة جداً. احجز مكانك الآن في رحلة لن تنساها.","كل ما تريد معرفته عن عرض الموسم الحصري! 💎 

 طرحتم الكثير من الأسئلة حول برنامجنا الجديد، وها نحن نأتيكم بكل التفاصيل.

اكتشف في هذا الكاروسال كل ما يميز باقتنا الحصرية لهذا الموسم: من فخامة الإقامة إلى الخدمات الإضافية التي تصنع الفارق.

نحن لا نعد بالتميز فقط، بل نظهره لكم بالتفصيل. 

 اكتشف تفاصيل العرض الكاملة على موقعنا الإلكتروني أو اتصل بنا مباشرة. فريقنا في انتظار استفساراتكم. 

 #عرض_الموسم #تفاصيل_البرنامج #عمرة_فاخرة #حج_VIP #فنادق_الحرم #خدمات_مميزة #الكوثر #الجزائر","تصميم فاخر وجذاب يعكس قيمة العرض. استخدام صور حقيقية وعالية الجودة للفنادق المذكورة والحافلات. كل سلايد يركز على ميزة واحدة مع أيقونة جذابة. في السلايد الأخير، استخدام عبارة 'احجز الآن' بحجم كبير ولون مميز لخلق دافع للفعل.","Abderahmane Mohamed","Project Task Manager","QkU5OHqs50n5oCnAzV9d"
"Wayso Project","P22-WA","[P22-WA] Image - الوقت يجري... والمقاعد قريب تخلص! مازال تخمم؟","Image","الوقت يجري... والمقاعد قريب تخلص! مازال تخمم؟","عرض الموسم الذي لا يعوّض!

مقاعد محدودة جداً

لا تنتظر! احجز مكانك الآن!","الفرصة الأخيرة! المقاعد المتبقية قليلة جداً! ⏳ 

 التردد هو أكبر سارق للفرص. عرض الموسم الاستثنائي من الكوثر للرحلات قارب على الانتهاء والمقاعد المتبقية تعد على الأصابع.

إذا كنت تحلم بهذه الرحلة، فالوقت المناسب للفعل هو الآن. غداً قد يكون متأخراً. 

 احجز مقعدك فوراً قبل أن تندم! اتصل بنا مباشرة على الرقم أو عبر الواتساب. 

 #الفرصة_الأخيرة #مقاعد_قليلة #احجز_فورا #لا_تتردد #عرض_لا_يعوض #الكوثر_للرحلات #الجزائر #عمرة_مستعجلة","تصميم جرافيكي يخلق شعوراً بالإلحاح (Urgency). يمكن استخدام صورة ساعة رملية أو عداد تنازلي. عبارة 'مقاعد محدودة' تكون باللون الأحمر وبخط عريض وواضح. الدعوة للعمل (CTA) تكون مباشرة وقوية. الألوان تكون صارخة لجذب الانتباه فوراً.","Abderahmane Mohamed","Project Task Manager","QkU5OHqs50n5oCnAzV9d"
