Project Name,Opportunity ID,Opportunity Name,Creative Format,Hooks,scripts,Ad Copy,Technical Directions,Opportunity Owner,Pipeline,Contact Id
"Wayso Project","V23-WA","[V23-WA] Video - شفت كلش، سمعت كلش، ومازال ما قررتش؟ ممكن هاد الشها","Video","شفت كلش، سمعت كلش، ومازال ما قررتش؟ ممكن هاد الشهادات هي لي تقنعك.","(مونتاج سريع لأقوى مقتطفات من شهادات العملاء)
عميل 1: '...أفضل قرار خديتو في حياتي.'
عميل 2: '...راحة بال ما حسيتهاش من قبل.'
عميل 3 (ابن): '...الحمد لله لي تهنيت على الوالدين.'
عميل 4: '...إذا راك متردد، نقولك حاجة وحدة: توكل على ربي واحجز مع الكوثر.'
(يظهر الوجه الإعلامي)
الكلمة الأخيرة ليكم. الرحلة هذه ما تتأجلش. والفرصة هذه ما تتعاودش.
القرار قرارك، والكوثر في انتظارك.","الكلمة الأخيرة... قبل فوات الأوان! ⏱️ 

 لقد استمعت للخبراء، ورأيت تفاصيل العروض، وشاهدت قصص العملاء. لم يبق شيء بعد الآن سوى اتخاذ القرار.

هذا الفيديو يجمع لك أقوى اللحظات وأصدق الكلمات التي ستساعدك على حسم أمرك. رحلة العمر تنتظرك، والندم على تضييع الفرصة صعب جداً. 

 لا تؤجل حلمك أكثر! هذا هو الوقت المناسب. احجز مع الكوثر اليوم وكن من سعداء الحظ هذا الموسم. 

 #القرار_النهائي #لا_تؤجل #شهادات_قوية #الوقت_الأن #الكوثر_تنتظرك #حج_وعمرة #الجزائر #توكل_على_الله","فيديو سريع وإيقاعه قوي. يبدأ بمونتاج خاطف (Fast-cut montage) لأقوى وأكثر الجمل تأثيراً من شهادات الفيديو السابقة. الموسيقى تكون حماسية ومحفزة. في النهاية، يظهر الوجه الإعلامي ليعطي الدعوة النهائية للعمل، بنبرة حاسمة وصادقة. تظهر معلومات الاتصال بشكل كبير وواضح.","Ahmed Benkali","Project Task Manager","QkU5OHqs50n5oCnAzV9d"
"Wayso Project","C24-WA","[C24-WA] Carousel - تحب تحجز بصح العملية تبانلك معقدة؟ في 4 خطوات برك،","Carousel","تحب تحجز بصح العملية تبانلك معقدة؟ في 4 خطوات برك، تكون معانا.","Slide 1: حجز رحلة عمرك مع الكوثر... أسهل مما تتخيل! (فقط 4 خطوات بسيطة).
Slide 2: الخطوة 1: تواصل معنا. عبر الهاتف، واتساب، أو زوروا وكالتنا. فريقنا مستعد للإجابة على كل أسئلتك.
Slide 3: الخطوة 2: اختر برنامجك. سنساعدك على اختيار الباقة التي تناسبك أنت وعائلتك perfectly.
Slide 4: الخطوة 3: أكّد حجزك. نقدم لك تسهيلات في الدفع ونساعدك في تحضير كل الوثائق اللازمة بسهولة.
Slide 5: الخطوة 4: مبروك! استعد لرحلة لا تُنسى. فريقنا سيبقى على تواصل معك حتى يوم السفر وبعده.","كيف تحجز رحلتك للحج أو العمرة في أقل من 10 دقائق؟ ⏰ 

 نعرف أن إجراءات الحجز قد تبدو معقدة للبعض، وهذا قد يكون سبباً في التأجيل.

لهذا السبب، قمنا في الكوثر بتبسيط العملية إلى أقصى حد. في 4 خطوات واضحة ومباشرة فقط، يمكنك ضمان مقعدك في رحلة العمر.

هدفنا هو إزالة كل العوائق من طريقك لتحقيق حلمك. 

 ابدأ رحلتك المقدسة اليوم. الخطوة الأولى بسيطة جداً: فقط تواصل معنا. 

 #الحجز_السهل #خطوات_بسيطة #عمرة_سهلة #حج_بسهولة #الكوثر_تسهلها_عليك #لا_للتعقيد #الجزائر #سفر","تصميم بسيط جداً ومباشر، يركز على السهولة. استخدام أيقونات كبيرة وواضحة لكل خطوة (أيقونة هاتف، أيقونة قائمة اختيار، أيقونة وثيقة، أيقونة طائرة). استخدام الأرقام (1, 2, 3, 4) بحجم كبير. الألوان تكون مشرقة وودودة.","Abderahmane Mohamed","Project Task Manager","QkU5OHqs50n5oCnAzV9d"
"Wayso Project","P25-WA","[P25-WA] Image - شوقك للأراضي المقدسة يكبر كل يوم... وقتاش راح تلبي","Image","شوقك للأراضي المقدسة يكبر كل يوم... وقتاش راح تلبي النداء؟","العمر يمضي... والفرص لا تدوم.

لبي نداء الشوق... رحلتك تنتظر.

الكوثر للرحلات - حقق حلمك الآن.","إلى متى ستؤجل نداء الروح؟ 🕋 

 في داخل كل واحد منا شوق لتلك البقاع الطاهرة. شوق لا يهدأ ولا ينام. لكن الحياة ومشاغلها تجعلنا نؤجل ونقول 'غداً'.

لكن 'غداً' ليس مضموناً لأحد.

لا تنتظر أكثر. اللحظة المثالية قد لا تأتي، أنت من يصنعها. لبي نداء قلبك اليوم. 

 حقق حلمك الآن. اضغط على الرابط وسجل معنا في رحلة العمر. 

 #لبي_النداء #شوق_الحرم #لا_تنتظر #حقق_حلمك #الكعبة_تجمعنا #الكوثر_للرحلات #الجزائر #لحظة_روحانية","تصميم مؤثر جداً وقوي. صورة سينمائية عالية الجودة للكعبة المشرفة من زاوية ملهمة، ربما وقت الفجر. النص يكون مكتوباً بخط أنيق ومدمج مع الصورة بشكل فني. التركيز على إثارة مشاعر الشوق والحنين الروحي.","Abderahmane Mohamed","Project Task Manager","QkU5OHqs50n5oCnAzV9d"