Project Name,Opportunity ID,Opportunity Name,Creative Format,Hooks,scripts,Ad Copy,Technical Directions,Opportunity Owner,Pipeline,Contact Id
"Wayso Project","C12-WA","[C12-WA] Carousel - مازالك حايرة كيفاش المنهاج هذا راح يعاونك صح؟ أروا","Carousel","مازالك حايرة كيفاش المنهاج هذا راح يعاونك صح؟ أرواحي نفهمك بالتفصيل.","Slide 1: كيف يعمل \""منهاج العودة إلى الفطرة الأنثوية\""؟ رحلة تحول في 3 محاور.\nSlide 2: المحور الأول: التشخيص وفهم الجذور. باستعمال أدوات علمية، نساعدك تفهمي أصل جروحك العاطفية، صدمات الماضي، و المعتقدات اللي راهي تعرقل فيك.\nSlide 3: المحور الثاني: الشفاء والتحرير. تتعلمي تقنيات عملية وفعالة للتصالح مع الماضي، مسامحة الذات، و التحرر من الأنماط السلبية اللي تدمر علاقاتك و ثقتك بنفسك.\nSlide 4: المحور الثالث: البناء والتمكين. بعد التحرير، تبداي تبني ذاتك الجديدة: تعزيز تقدير الذات، وضع حدود صحية، و اكتشاف قوتك الأنثوية الأصيلة لتعيشي بسكينة و توازن.\nSlide 5: المنهاج ماشي غير دروس نظرية... هو رحلة تطبيقية، فيها متابعة شخصية، و دعم من مجتمع تاع نساء يشبهوك. هو استثمار في أغلى حاجة عندك: نفسك.","خريطة طريقك نحو الشفاء والسكينة. \n\n قد تتساءلين: كيف يمكن لهذا المنهاج أن يساعدني بشكل عملي؟\n\nالأمر ليس سحراً، بل هو منهجية علمية واضحة ومدروسة تأخذك خطوة بخطوة من مرحلة فهم المشكلة إلى مرحلة الشفاء ثم بناء شخصية جديدة وقوية.\n\nاسحبي الشاشة لتكتشفي المحاور الثلاثة الأساسية لرحلة التحول معنا. \n\n كل الأسئلة عندها جواب. اسألينا في التعليقات أو تواصلي معنا. \n\n #منهجية_عمل #كيف_يعمل #خريطة_الطريق #الشفاء_النفسي #تطوير #علم_النفس #alger","تصميم تعليمي وواضح (Infographic style). كل سلايد يمثل محوراً بلون وأيقونة خاصة به (مثال: عدسة مكبرة للتشخيص، قلب يتعافى للشفاء، بذرة تنمو للبناء). استخدام خطوط واضحة ورسمية. تصميم احترافي يبعث على الثقة.","Abderahmane Mohamed","Project Task Manager","QkU5OHqs50n5oCnAzV9d"
"Wayso Project","P13-WA","[P13-WA] Image - هذيك الراحة اللي تحوسي عليها برا... راهي كامنة لدا","Image","هذيك الراحة اللي تحوسي عليها برا... راهي كامنة لداخل فيك.","السكينة ليست وجهة تصلين إليها، بل هي بوصلة تعودين إليها. منهاجنا هو طريقك للعودة.","أين تجدين السلام الداخلي؟ \n\n في خضم ضغوطات الحياة، نبحث جميعاً عن شعور بالسكينة وراحة البال. لكننا غالباً ما نبحث في الأماكن الخاطئة.\n\nالسلام الحقيقي لا يأتي من الخارج، بل ينبع من الداخل عندما نعود إلى مركزنا، إلى فطرتنا.\n\n\""منهاج العودة إلى الفطرة الأنثوية\"" مصمم ليكون بوصلتك في هذه الرحلة. \n\n ابداي خطوتك الأولى نحو السلام الداخلي. راسلينا الآن. \n\n #السلام_الداخلي #السكينة #راحة_نفسية #البوصلة_الداخلية #تأمل #الجزائر #dzair","صورة رمزية قوية. بوصلة قديمة وأنيقة موضوعة على خريطة أو بين يدي امرأة. الإضاءة دافئة ومركزة على البوصلة. الألوان ترابية وهادئة. النص مكتوب بخط serif أنيق.","Abderahmane Mohamed","Project Task Manager","QkU5OHqs50n5oCnAzV9d"
"Wayso Project","V14-WA","[V14-WA] Video - الفرصة اللي تغير حياتك ما تجيش كل يوم. إذا راكي وا","Video","الفرصة اللي تغير حياتك ما تجيش كل يوم. إذا راكي واجدة، هذا هو وقتك!","(صوت Voiceover حماسي ومباشر، مع موسيقى سريعة الإيقاع)\nراكي تأجلي في قرار تغيير حياتك؟\nتقولي غدوة نبدا... السمانة الجاية... العام الجاي...\nبصح حياتك راهي تمشي الآن!\nكل يوم يروح هو فرصة ضايعة باش تكوني سعيدة و مرتاحة.\n\""منهاج العودة إلى الفطرة الأنثوية\"" فتح أبواب التسجيل للدورة الجديدة.\nهذه فرصتك باش تبداي رحلة الشفاء الحقيقية.\nباش تتخلصي من القلق.\nباش تبني علاقات صحية.\nباش تلقاي روحك.\nلكن انتبهي!\nالمقاعد محدودة جداً باش نضمنوا المتابعة الشخصية لكل مشتركة.\nوالتسجيلات راح تغلق قريباً.\nالقرار قرارك. تقدري تبقاي في نفس الدوامة... أو تقدري تاخذي القرار اللي راح يغير كلش.\nالوقت راهو يمشي.","🚨 آخر نداء: فرصتك الأخيرة للانضمام! \n\n هل أنتِ مستعدة للتغيير الحقيقي؟ هل تعبتِ من التأجيل والوعود لنفسك؟\n\nفتحت أبواب التسجيل في الدفعة الجديدة من \""منهاج العودة إلى الفطرة الأنثوية\""، والطلب كبير جداً!\n\nلأننا نركز على الجودة والمتابعة الفردية، عدد المقاعد محدود جداً وسيغلق باب التسجيل فور اكتمال العدد.\n\nلا تدعي هذه الفرصة تفوتك. قرار اليوم يصنع غدك. \n\n المقاعد محدودة! سجلي الآن في منهاج العودة إلى الفطرة الأنثوية و اضمني مكانك. الرابط في البايو. \n\n #فرصة_أخيرة #مقاعد_محدودة #سجل_الان #لا_تؤجل #تغيير #الجزائر #dz","فيديو Motion Graphics سريع ومباشر. استخدام عد تنازلي على الشاشة. كلمات مفتاحية (الآن، فرصة، مقاعد محدودة) تظهر بحجم كبير وبألوان قوية (أحمر، برتقالي). الأيقونات والرسومات تكون متحركة بشكل سريع وجذاب. في النهاية يظهر زر \""سجلي الآن\"" كبير وواضح.","Ahmed Benkali","Project Task Manager","QkU5OHqs50n5oCnAzV9d"
"Wayso Project","C15-WA","[C15-WA] Carousel - ماشي غير حنا اللي نشكروا في خدمتنا... خلي اللي جرب","Carousel","ماشي غير حنا اللي نشكروا في خدمتنا... خلي اللي جربوا هوما اللي يحكموا.","Slide 1: \""واش قالوا المشاركات على منهاج الفطرة؟\"" شهادات حقيقية غيرت حياتهن.\nSlide 2: [شهادة 1 - أمينة. و]: \""والله حياتي تبدلت 180 درجة! كنت عايشة في قلق وخوف، اليوم نحس بواحد السكينة جامي حسيتها. شكراً دكتورة.\""\nSlide 3: [شهادة 2 - سارة. ب]: \""أخيراً لقيت روحي من جديد. فهمت علاش كنت نطيح في نفس الغلطات. هذا المنهاج كان الضوء في آخر النفق بالنسبة ليا.\""\nSlide 4: تجربتهم تقدر تكون تجربتك نتي تانيك! الشجاعة ماشي أنك ما تخافيش، الشجاعة هي أنك تبداي رغم الخوف. انضمي لينا.","النتائج تتحدث عن نفسها! \n\n أفضل طريقة لتعرفي قيمة شيء ما هي أن تستمعي لمن جربه قبلك.\n\nجمعنا لكِ بعض الشهادات الصادقة من قلوب مشاركات في \""منهاج العودة إلى الفطرة الأنثوية\"". قصصهن وتجاربهن هي أكبر دليل على قوة التحول الذي يمكنكِ تحقيقه.\n\nاسحبي الشاشة واقرئي بنفسك. \n\n اقراي القصص الكاملة في الستوري و اكتشفي المزيد. \n\n #شهادات #تجارب_حقيقية #socialproof #نتائج #ثقة #الجزائر #femmealgerienne","تصميم أنيق وجدير بالثقة. كل شهادة تكون على شكل اقتباس (Quote) مع اسم المشاركة (الأحرف الأولى فقط للخصوصية). يمكن وضع صورة رمزية (أفاتار) بجانب كل شهادة. استخدام علامات الاقتباس الكبيرة. الخلفية تكون هادئة ومحترفة.","Abderahmane Mohamed","Project Task Manager","QkU5OHqs50n5oCnAzV9d"
"Wayso Project","P16-WA","[P16-WA] Image - كاين بزاف حلول... بصح كاين حل واحد برك مصمم ليك، ي","Image","كاين بزاف حلول... بصح كاين حل واحد برك مصمم ليك، يا بنت بلادي.","فطرتك هي قوتك. منهاج مصمم خصيصاً للمرأة الجزائرية، يفهم ثقافتك، تحدياتك، و أحلامك.","مصمم خصيصاً لكِ. \n\n نحن لا نستورد حلولاً جاهزة لا تناسب واقعنا. \""منهاج العودة إلى الفطرة الأنثوية\"" نابع من صميم بيئتنا ومصمم ليفهم المرأة الجزائرية بعمق.\n\nلأننا نؤمن بأن قوتك الحقيقية تكمن في فطرتك وهويتك الأصيلة.\n\nهذا المنهاج لكِ ومنكِ. \n\n اكتشفي قوة فطرتك. تواصلي معنا الآن. \n\n #جزائرية_وافتخر #صنع_في_الجزائر #هويتنا #أصالة #المرأة_الجزائرية #dz","صورة تجمع بين الأصالة والحداثة. يمكن أن تكون صورة رمزية ليد امرأة عليها حناء تمسك بهاتف ذكي، أو خلفية لزخرفة جزائرية أصيلة مع تصميم غرافيكي عصري. النص يكون في الوسط، واضح وقوي. استخدام ألوان العلم الجزائري بلمسة فنية.","Abderahmane Mohamed","Project Task Manager","QkU5OHqs50n5oCnAzV9d"
"Wayso Project","V17-WA","[V17-WA] Video - كل قصة عندها نهاية... بصح قصتك نتي، هادي هي البداي","Video","كل قصة عندها نهاية... بصح قصتك نتي، هادي هي البداية تاعها.","(تتحدث الدكتورة فريال مباشرة للكاميرا بأسلوب شخصي وملهم، كأنها في مكالمة فيديو)\nوصلنا لآخر الحملة، بصح هادي ماشي النهاية.\nهادي هي البداية الحقيقية تاعك.\nشفتي معانا المشكل، شفتي الحل، و شفتي قصص نجاح بنات كيما نتي.\nدوك الكرة راهي في ملعبك.\nالسؤال ماشي إذا المنهاج فعال ولا لالا، السؤال هو: هل أنتِ مستعدة للتغيير؟\nهل أنتِ مستعدة تتخلي على الألم اللي راكي شادة فيه؟\nهل أنتِ مستعدة تستثمري في أغلى حاجة عندك: سعادتك و راحة بالك؟\nإذا كانت إجابتك نعم، أنا و فريقي كامل رانا نستناو فيك في الجهة الأخرى.\nما تخليش الخوف يقرر في بلاصتك.\nمصيرك بين يديك.","رسالة أخيرة من القلب... إليكِ. \n\n بعد كل ما قيل، يبقى القرار الأهم هو قرارك أنتِ.\n\nفي هذا الفيديو الأخير، توجه لك الدكتورة فريال جمعي رسالة مباشرة وشخصية لمساعدتك في اتخاذ الخطوة التي قد تغير مسار حياتك بالكامل.\n\nهذه ليست مجرد دعوة للانضمام، بل هي دعوة لتبدئي حياة جديدة تستحقينها. \n\n التحول بين يديك. ما تضيعيش هاد الفرصة. سجلي الآن و ابداي حياة جديدة! \n\n #رسالة_لك #قرار #بداية_جديدة #التحول #استثمار_في_الذات #الجزائر #dz","فيديو مصور بأسلوب شخصي جداً (UGC Style). الدكتورة فريال تتحدث من مكتبها أو مكان هادئ في منزلها. التصوير يكون قريب (Close-up) لإظهار الصدق في عينيها. النبرة تكون دافئة، ملهمة، ومباشرة. لا توجد موسيقى صاخبة، فقط صوتها الواضح. في النهاية، يظهر رابط التسجيل على الشاشة بشكل واضح.","Ahmed Benkali","Project Task Manager","QkU5OHqs50n5oCnAzV9d"
"Wayso Project","C18-WA","[C18-WA] Carousel - فاتك كاش بوست؟ هادا هو ملخص رحلتك نحو السكينة في 5","Carousel","فاتك كاش بوست؟ هادا هو ملخص رحلتك نحو السكينة في 5 خطوات.","Slide 1: رحلتك إلى الفطرة الأنثوية: خلاصة المنهاج في 5 خطوات.\nSlide 2: [المشكلة]: تعيشين في ضياع، قلق، و تكررين نفس الأخطاء في علاقاتك لأنك انفصلتِ عن فطرتك الأنثوية الأصيلة.\nSlide 3: [الحل]: \""منهاج العودة إلى الفطرة الأنثوية\""، برنامج علاجي علمي وعملي مصمم خصيصاً للمرأة الجزائرية ليعيدك إلى أصلك.\nSlide 4: [الفوائد]: النتيجة هي سكينة داخلية، ثقة حقيقية بالنفس، القدرة على بناء علاقات صحية، و التوافق التام بين عقلك، قلبك، وروحك.\nSlide 5: [القرار]: قرارك اليوم يحدد مصيرك غدوة. هل أنتِ مستعدة لبدء رحلة الشفاء والتحول؟ التسجيل مفتوح الآن والمقاعد محدودة!","خلاصة رحلتك نحو ذاتك الحقيقية. \n\n إذا كنت قد انضممت إلينا مؤخراً، أو أردت تذكيراً سريعاً، فهذا الملخص لك.\n\nفي هذا الكاروسال، نلخص لك المشكلة التي تواجهينها، الحل الذي نقدمه، والنتائج الرائعة التي تنتظرك.\n\nكل ما تحتاجين معرفته لاتخاذ قرارك موجود هنا. \n\n قرري التغيير اليوم. راسلينا لمعلومات أكثر. \n\n #ملخص #الخلاصة #رحلة_الشفاء #منهاج_الفطرة #قرارك #الجزائر #dzfemme","تصميم يلخص الحملة كلها. كل سلايد يستخدم أيقونة ولوناً من المنشورات السابقة (مشكلة، حل، فائدة، قرار) لخلق ترابط بصري. التصميم يكون نظيفاً ومباشراً. السلايد الأخير يكون دعوة للعمل واضحة جداً مع إحساس بالاستعجال.","Abderahmane Mohamed","Project Task Manager","QkU5OHqs50n5oCnAzV9d"
"Wayso Project","P19-WA","[P19-WA] Image - غدوة راح تقولي 'يا ريتني بديت اليوم'. ما تخليش 'يا","Image","غدوة راح تقولي 'يا ريتني بديت اليوم'. ما تخليش 'يا ريت' تكون جزء من قاموسك.","الآن أو أبداً. المقاعد الأخيرة المتبقية. لا تدعي التردد يسرق منك فرصة تغيير حياتك.","⏰ الوقت ينفد... والفرصة لن تتكرر! \n\n هذا هو تذكيرنا الأخير.\n\nتبقى عدد قليل جداً من المقاعد في الدفعة الجديدة من \""منهاج العودة إلى الفطرة الأنثوية\"". باب التسجيل على وشك الإغلاق نهائياً.\n\nأفضل وقت لبدء التغيير كان البارحة. ثاني أفضل وقت هو الآن.\n\nلا تنتظري أكثر. \n\n الآن أو أبداً! تواصلي معنا و ابداي رحلتك. \n\n #الآن_أو_أبدا #فرصة_أخيرة #استعجال #لا_تتردد #قرار #الجزائر #dz","تصميم قوي ومباشر يركز على الاستعجال. خلفية بلون واحد قوي (أحمر داكن أو كحلي). النص مكتوب بخط كبير وعريض وواضح (Sans-serif bold). يمكن إضافة رمز ساعة رملية أو عداد يقترب من النهاية. التركيز الكلي على عبارة \""الآن أو أبداً\"".","Abderahmane Mohamed","Project Task Manager","QkU5OHqs50n5oCnAzV9d"